{
  "id": "019a1c00-0000-7000-8000-000000000201",
  "title": "SQL quiz",
  "due_date": "2026-10-26",
  "start_time": "09:00",
  "end_time": "10:00",
  "priority": "high",
  "project_id": "019a1c00-0000-7000-8000-000000000101",
  "repeat": "never",
  "reminder": "1d",
  "notes": "Bring student card",
  "done": false,
  "done_at": null,
  "created_by": "assistant",
  "source_note_id": "019a1c00-0000-7000-8000-000000000301",
  "created_at": "2026-10-23T08:12:00+07:00",
  "updated_at": "2026-10-23T08:12:00+07:00"
}
